{
  "htrPage": 1,
  "width": 200,
  "height": 100,
  "regions": [
    {
      "id": "r1",
      "type": "text",
      "sourceType": "text",
      "box": {
        "x1": 10,
        "y1": 10,
        "x2": 110,
        "y2": 70
      },
      "polygon": [
        {
          "x": 10,
          "y": 10
        },
        {
          "x": 110,
          "y": 10
        },
        {
          "x": 110,
          "y": 70
        },
        {
          "x": 10,
          "y": 70
        }
      ],
      "lines": [
        {
          "id": "l1",
          "box": {
            "x1": 10,
            "y1": 10,
            "x2": 110,
            "y2": 30
          },
          "polygon": [
            {
              "x": 10,
              "y": 10
            },
            {
              "x": 110,
              "y": 10
            },
            {
              "x": 110,
              "y": 30
            },
            {
              "x": 10,
              "y": 30
            }
          ],
          "baseline": [
            {
              "x": 10,
              "y": 25
            },
            {
              "x": 110,
              "y": 25
            }
          ],
          "text": "été 水"
        },
        {
          "id": "l2",
          "box": {
            "x1": 10,
            "y1": 50,
            "x2": 110,
            "y2": 70
          },
          "polygon": [
            {
              "x": 10,
              "y": 50
            },
            {
              "x": 110,
              "y": 50
            },
            {
              "x": 110,
              "y": 70
            },
            {
              "x": 10,
              "y": 70
            }
          ],
          "baseline": [
            {
              "x": 10,
              "y": 65
            },
            {
              "x": 110,
              "y": 65
            }
          ],
          "text": "second line"
        }
      ]
    }
  ],
  "source": "pagexml",
  "provenance": {}
}